161,"אנשים פרטיים, נפגע בית 🏠, נפגע עסק 💼, נפגע רכב 🚗, עצמאים/ות",הגשת תביעה,"מוקד חירום, אתר מרכז זכויות ",הראל ביטוח ופיננסים ,https://www.harel-group.co.il/Insurance/Pages/operation-rising-lion-elementary.aspx,20/06/2025,"האם קיימות הטבות נוספות הניתנות ללקוחות הראל עקב מבצע ""עם כלביא""? 
אנחנו עושים כל מאמץ לבצע את ההתאמות הנדרשות בעקבות המצב הביטחוני המשתנה במהירות. עד כה, ביצענו את ההתאמות הבאות:

​הארכנו את המועדים לחידושי פוליסות רכב, דירה ועסק ולהמצאת אישורים רלבנטיים תוך שמירה על רצף ביטוחי לפוליסה הקודמת בהראל. 
נתנו הקלות לגבי בדיקת שמאי מקדימה של הנכס לקראת חידושי פוליסות דירה.
נתנו הרחבות בכיסויים ובתחולה של פוליסות עסקים.  
ניתן לקבל פרטים מלאים לגבי חידוש פוליסת הביטוח וההטבות בפוליסות הרלבנטיות מסוכן הביטוח שלכם.

אנו עומדים לרשותכם ולמענכם בכל שאלה, בקשה או הבהרה, בתקווה לימים שקטים וטובים יותר. ניתן לפנות אלינו למוקד השירות בטלפון: 03-9208040​, או לסוכן הביטוח שלכם, שישמח לסייע.   
מידע על סוכן הביטוח שלכם נמצא בעמוד הביטוח באזור האישי שלכם באתר. ​​​ ​מוקדי שירות הלקוחות שלנו ערוכים לקבלת שיחות וזמינים 24/7:
בטלפון: +972-3-7547030 ​
בווטסאפ: ​052-754458​9​​​",,,,,,,,,,,,,,,,,,
162,נפגעי גוף / נפש,הגשת תביעה,ביטוח תאונות אישיות,הראל ביטוח ופיננסים ,https://www.harel-group.co.il/Insurance/personal-accident/information/Pages/operation-rising-lion.aspx,20/06/2025,"מידע לבעלי ביטוח תאונות אישיות
​​בפוליסות ביטוח תאונות אישיות של הראל קיימים מגוון כיסויים ביטוחיים למקרים שנגרמו כתוצאה מתאונה, וביניהם: 
מקרה מוות
שברים
כוויות
אשפוז
נכות צמיתה 
פגיעה ביכולות התפקוד העיסוקית
והכל בהתאם לתנאי הפוליסה והכיסויים שנרכשו על-ידי המבוטח.

אם אתם מבוטחים בביטוח תאונות אישיות, ונפגעתם כתוצאה מאירועי מבצע ""עם כלביא"" - באפשרותכם לפנות אלינו לבחינת זכאותכם ולהגיש תביעה. 
אנא פרטו, ככל שניתן, את נסיבות הפגיעה בצירוף מסמכים רפואיים, על מנת שנוכל להעניק לכם מענה מקצועי ומהיר.
כל מקרה ייבדק לגופו, בהתאם לתנאי ולחריגי הפוליסה.​ 
 להגשה לחצו פה https://www.harel-group.co.il/Pages/default.aspx/?LoginOriginatingAction=PersonalInfoPage&isshowlogin=true&Source=%2fpersonal-info%2fmy-claims%2fPages%2fmidlife-claim-apply.aspx%3fso%3d1&Type=PortalOTP",,,,,,,,,,,,,,,,,,
163,"עצמאים/ות, אנשים פרטיים, נפגעי גוף / נפש, נפגעי פעולות איבה, נפגע בית 🏠, נפגע רכב 🚗, נפגע עסק 💼",הגשת תביעה,ביטוח רכוש,קרן הפיצויים- רשות המיסים ,https://www.gov.il/he/pages/pa20625-1,20/06/2025,"שימו לב: רשות המסים מודיעה על סגירה יזומה, החל מהיום בשעה 17:00, של מרבית השירותים המקוונים באתר האינטרנט של הרשות ובפורטל המייצגים. המערכות יפתחו שוב ביום ראשון בשעה 07:00 (ולצד זה- לתשומת ליבכם, בעקבות מבצע עם כלביא, יינתן מענה טלפוני במוקד בנושאי נזק ישיר וביטוח רשות בלבד. לפניות בנושאים אחרים ניתן לקבל מענה באמצעות מערכת הפניות של רשות המסים).
 
השירותים - קבלת מספרי הקצאה לחשבוניות באמצעות בתי תוכנה במסגרת ""חשבונית ישראל"",  הגשת תביעות על ארוע נזק ישיר לרכוש וביטוח רשות של חפצים ביתיים מפני נזקי מלחמה יפעלו כרגיל.
עדכון בנושא קבלת קהל! בשל המצב הביטחוני, ביום א', 22.6.2025, לא תתקיים קבלת קהל בכל משרדי רשות המסים. מענה מקוון יינתן דרך מערכת הפניות באתר רשות המסים. לתשומת לבכם, חלק משירותי המידע חסומים לגישה מחוץ למדינת ישראל. צור קשר קרן הפיצויים- באמצעות האיזור האישי ברשות המיסים או לשלוח מיילים:https://www.gov.il/he/pages/compensation_fund_reception",,,,,,,,,,,,,,,,,,
164,"נפגע בית 🏠, נפגע רכב 🚗, נפגע עסק 💼, ""תקועים בחו""""ל"", אנשים פרטיים",הגשת תביעה,ביטוח רכוש,קרן הפיצויים- רשות המיסים ,https://www.gov.il/he/pages/pa121023-3,20/06/2025,"מוקד קרן הפיצויים של רשות המסים לטיפול בנזקים ישירים הנגרמים למבנים ולרכוש פרטי ועסקי זמין לפניות הציבור בימים ראשון עד חמישי בשעות 8:15 עד 18:45 בטלפון 4954*.

המעוניינים בכך, יכולים להגיש תביעת נזק ישיר מקוונת הזמינה 24 שעות ביממה.
לתשומת לבכם, חלק משירותי המידע חסומים לגישה מחוץ למדינת ישראל. צור קשר קרן הפיצויים- באמצעות האיזור האישי ברשות המיסים או לשלוח מיילים:https://www.gov.il/he/pages/compensation_fund_reception",,,,,,,,,,,,,,,,,,
165,"אנשים פרטיים, עצמאים/ות, ""תקועים בחו""""ל""",זכויות,תקשורת,פלאפון,https://www.facebook.com/photo?fbid=1146490707517401&set=a.636896401810170,15/06/2025,"אנחנו יודעים שזו תקופה לא פשוטה, בטח כשאתם רחוקים מהבית או מנסים לשמור על קשר עם היקרים לכם.
לכן, ללקוחותינו שנמצאים בחו״ל שלחנו 2 ג׳יגה גלישה ו-50 דקות שיחה, שיתעדכנו אוטומטית.
ולמי שבארץ - תוספת של 100 ג׳יגה לחודש הקרוב (עד ל15.7.25)",,,,,,,,,,,,,,,,,,
166,"אנשים פרטיים, עצמאים/ות, נפגע בית 🏠, נפגע עסק 💼, נפגע רכב 🚗, נפגעי פעולות איבה",זכויות,תקשורת,פלאפון,https://www.facebook.com/photo?fbid=1147224604110678&set=a.636896401810170,16/06/2025,"עדכון מ-16/06/2025- לא ברור איך מגיעים לחמ""ל הפנימי שלהם או מתי הם מגיעים לתיקונים במלונות השונים, ציטוט: היום הגענו עם ניידת השירות והתיקונים של פלאפון לסייע ולספק תיקונים חינם למפונים שבתיהם נפגעו ומתאכסנים בכפר המכביה. בנוסף, הקמנו חמ״ל פנימי שמטפל בפניות של עובדים, חיילים, כוחות הביטחון ואזרחים שזקוקים לעזרה. שנדע ימים שקטים ובטוחים 🩵",,,,,,,,,,,,,,,,,,
167,"אנשים פרטיים, עצמאים/ות, ""תקועים בחו""""ל""",קבלת קהל,תקשורת,גולן  טלקום ,https://www.facebook.com/photo/?fbid=1127677916054543&set=a.622867033202303,18/06/2025,"אין הטבה משמעותית, רק עדכון על הזמינות: אנחנו זמינים עבורכם במגוון ערוצים: באתר, במוקד הטלפוני *0058 ובואטסאפ 24/7 058-7778888",,,,,,,,,,,,,,,,,,
168,"ילדים/ ות, מי שנפגע לו הבית/הרכב/ העסק מהטילים , אנשים פרטיים",קבלת קהל,תקשורת,סלקום,https://www.facebook.com/share/p/1JAGvGujpT/,15/06/2025,"אנחנו פה בשבילכם
סניפי סלקום יהיו פתוחים לרשותכם בין השעות 10:00-18:00 💜
לרשימת הסניפים: https://bit.ly/4kIpSha",,,,,,,,,,,,,,,,,,
169,"""תקועים בחו""""ל"", אנשים פרטיים, עצמאים/ות",זכויות,תקשורת,סלקום,https://www.facebook.com/share/p/1AjGzcyRWf/,13/06/2025,"לקוחות סלקום שנמצאים בחו״ל 🌎
פתחנו עבורכם עד 2GB גלישה ו־30 דקות שיחה ו-SMS ללא עלות, כדי שתוכלו לשמור על קשר עם המשפחה ולהרגיש קצת יותר קרוב.
ההטבה מתעדכנת אוטומטית ואין צורך לפנות לשירות הלקוחות.
ואם צריך עזרה – אנחנו זמינים בשבילכם 24/7:
📞 בטלפון: ‎+972-52-9986919
💬 בוואטסאפ: 052-4999123
סלקום ממשיכה לחבר את הישראלים בכל מקום בעולם 💜",,,,,,,,,,,,,,,,,,
170,"ילדים/ ות, אנשים פרטיים",זכויות,תקשורת,סלקום,https://www.facebook.com/share/p/16rVZd3rAP/,15/06/2025,"שימו לב - יש פוסט מ-13/06/25 וישפוסט מ-15/06/25, שימו לב שלא מחייבים אתכם ושהערוצים אכן פתוחים ללא עלות-                                                                                                                                                                                                                                                                        סלקום ממשיכה לחבר את הישראלים, במיוחד עכשיו עם תכנים לכל המשפחה ללא תוספת תשלום 🎬❤️
לאור המצב, העלינו היום את ״ספיישל ערוץ ZOOM״ לכל לקוחות סלקום TV – ללא תוספת תשלום.
ערוץ 84 מציע תכנים איכותיים ומגוונים לילדים בגילי 5-14 👧🧒
בנוסף, מגוון ערוצי הילדים והמשפחה בסלקום TV פתוחים ללא תוספת תשלום:
🌸 ערוץ Zoom Toon
🎈 דיסני ודיסני ג’וניור
🌟 ערוץ הילדים, לוגי, ג׳וניור, בייבי;
📺 וגם קטלוג ה-VOD שלנו פתוח – שפע של סדרות, סרטים והפתעות.
אנחנו כאן איתכם 💜שימו לב יש 2 עדכונים- 13/06/25 וב-15/06/25",,,,,,,,,,,,,,,,,,
171,"נפגעי גוף / נפש, נפגעי פעולות איבה, נפגע בית 🏠, נפגע רכב 🚗, נפגע עסק 💼",מידע ,תקשורת,סלקום,https://www.ynet.co.il/digital/technews/article/bkj1nbzvlg,,,,,,,,,,,,,,,,,,,,
172,"אנשים פרטיים, עצמאים/ות",קבלת קהל,מידע סטטיסטי,"הלמ""ס- הלשכה המרכזית לסטטיסטיקה",https://www.facebook.com/photo/?fbid=1157297783102044&set=a.316545393843958,17/06/2025,"*עדכון חשוב* בעקבות האירועים האחרונים (מבצע ""עם כלביא"") ועד הודעה חדשה אנחנו עובדים במתכונת עבודה מצומצמת.
הלמ""ס שומרת על רציפות תפקודית מלאה וממשיכה לספק נתונים מהימנים ועדכניים בנושאי דמוגרפיה, כלכלה וחברה – הן למקבלי החלטות והן לציבור הרחב. מוזמנים להתעדכן באתר הלמ""ס www.cbs.gov.il 
 📧 לקבלת מידע סטטיסטי - ניתן לפנות בטופס מקוון: https://bit.ly/PublicServiceInfo או בכתובת הדוא""ל: info@cbs.gov.il
👩‍💻למשתתפים בסקרים - ניתן לפנות בטופס מקוון:  https://survey.gov.il/he/Are_you_in_a_survey 
 ובמוקד הטלפוני 1-800-210-290.
שימו 💙 בשלב זה הסקרים נערכים בטלפון בלבד. 
כמובן, זמינים לכל שאלה גם כאן. 
אנחנו מודים לכם על ההבנה ועל שיתוף הפעולה ומקווים לשוב במהרה לימים בטוחים ורגועים 🙏💙🤍",,,,,,,,,,,,,,,,,,
173,"אנשים פרטיים, הגיל השלישי",מידע ,"מוקד חירום, אתר מרכז זכויות ",משרד הרווחה והבטחון החברתי- מינהל אזרחים ותיקים ,https://www.gov.il/he/pages/am_kelalvi_seniors_news,17/06/2025,"המלצות לאזרחים ותיקים להתמודדות במלחמה:                                                                                                                                                                                                                                                                                                                                                                                                          מבצע ""עם כלביא"" וקצב האירועים המהיר המאפיין את הימים והלילות מציב אתגרים ייחודיים בפני כלל תושבי מדינת ישראל. אתגרים אלו עשויים להיות מורכבים פי כמה עבור אוכלוסיית האזרחים הוותיקים.
 התנהלות מיטבית של הפרט והמשפחה כמכלול תסייע להתנהל באחריות במצב החירום ולשמור על החוסן האישי והמשפחתי, הבריאות והביטחון שלכם ושל המשפחה כולה:

1. שמירה על הנחיות ההתגוננות המופצות על ידי פיקוד העורף – שמירה על הנחיות פיקוד העורף מצילות חיים. לעיתים ההנחיות מורכבות ויש קושי לעקוב אחר ההוראות וההנחיות המשתנות בתדירות גבוהה. מומלץ למנות בן משפחה שיתווך את ההנחיות בשפה ברורה וסבלנית ויסיע בבחירת המרחב המוגן ודרכי ההגעה אליו.
2. מוכנות אישית – הכנת המרחב המוגן לשהייה של מספר ימים. הצטיידות במצרכים, בתרופות, בתאורה, במוצרי היגיינה ייחודיים ובמוצרי פנאי להפגת השגרה. הכנת תיק אישי ובו בגדים, תרופות ומסמכים למקרה של פינוי מיידי.
3. אמצעי תקשורת – מכשירי טלפון נייד, רדיו ואמצעי הטענת המכשיר וכן סוללה רזרבית. הכנה של רשימות טלפונים למקרה שבו המכשיר הנייד יושבת.
4. שמירה על שגרה יומית ומשמעות – פעילות גופנית, מפגש בין אישי, פעילות מנטלית וכו'. במידה וניתן לצאת מהבית בהתאם להנחיות פיקוד העורף מומלץ לצאת מהבית לטיול קצר. שמירה על ניקיון הבית, בישול ומפגשים חברתיים.
5. התאמה מחודשת של מרחב המחייה – הכשרת המרחב המוגן כמרחב החיים המשמעותי בבית (חדר שינה).
6. יש להתעדכן באופן יום יומי בהנחיות פיקוד העורף ובמענים הניתנים על ידי משרדי הממשלה והרשות המקומית. ניתן לפנות למוקד פניות ציבור האזרחים הוותיקים 8840* של המשרד לשוויון חברתי וקידום מעמד האישה.
7. מינון נכון ומבוקר של צריכת אמצעי תקשורת – צריכה בלתי מבוקרת של חדשות עשויה להפריע לתפקוד היום יומי ולהגביר חרדה. צרכו תקשורת בצורה מבוקרת וממקורות אמינים ורשמיים בלבד.
8. לא לפחד לפחד – במצב של אי ודאות ושינויים מהירים חשוב לתת מקום לתחושות ולהרגשות של פחד, חרדה בלבול ומצבי רוח משתנים. היו סובלניים כלפי עצמכם ואחרים. זה טבעי לחלוטין.
במידת הצורך ניתן לקבל מענה נפשי במוקד פניות האזרחים הוותיקים 8840* של המשרד לשוויון חברתי וקידום מעמד האישה.
משמעות – דווקא בימים אלו חשוב למצוא משמעות בעשייה. ניתן להירתם למאמץ המלחמתי ולהתנדב בארגונים שונים ובמגוון תחומים.
מוקד פניות האזרחים הוותיקים 8840* של המשרד לשוויון חברתי וקידום מעמד האישה עומד לרשותכם 24/7 בטלפון 8840*.

זקוקים לסיוע – 
המוקד פועל במתכונת חירום על מנת לסייע במתן מענים שונים כגון: סיוע בשינוע תרופות ומזון (רכישת התרופות / המזון תתבצע מכספי האזרח), מענה נפשי, הפגת בדידות, סיוע דיגיטלי ועוד. המוקד פעיל בשפות עברית, אנגלית, אמהרית, ערבית ורוסית. מוקד ארצי טלפוני 118 (פעיל 24 שעות, 7 ימים בשבוע), ניתן לפנות למוקד גם בהודעת טקסט ניתן לפנות אליו גם בהודעת טקסט כתובה למספר 050-2270118.  טופס פניות הציבור https://www.gov.il/he/service/contact-the-ministry-of-labor-welfare-and-social-services       עובדים סוציאליים מהרשויות המקומיות וממשרד הרווחה מלווים את האזרחים במלונות המפונים ומסייעים להם גם במיצוי זכויות מול הרשויות השונות.  
",,,,,,,,,,,,,,,,,,
174,"אנשים פרטיים, הגיל השלישי",קבלת קהל,"מוקד חירום, אתר מרכז זכויות ",משרד הרווחה והבטחון החברתי- מינהל אזרחים ותיקים ,https://www.gov.il/he/departments/units/molsa-units-senior-citizens,17/06/2025,"מוקד ארצי טלפוני 118 (פעיל 24 שעות, 7 ימים בשבוע), ניתן לפנות למוקד גם בהודעת טקסט ניתן לפנות אליו גם בהודעת טקסט כתובה למספר 050-2270118.  טופס פניות הציבור https://www.gov.il/he/service/contact-the-ministry-of-labor-welfare-and-social-services       עובדים סוציאליים מהרשויות המקומיות וממשרד הרווחה מלווים את האזרחים במלונות המפונים ומסייעים להם גם במיצוי זכויות מול הרשויות השונות.                                                     ניתן גם לפנות למוקד פניות האזרחים הותיקים במספר *8840 24/7. 
משרד הרווחה והביטחון החברתי העביר לרשויות שנפגעו תקציב גמיש לרכישת ציוד בסיסי ראשוני לאזרחים אשר פונו מבתיהם.
בהתאם להנחיות ההתגוננות של פיקוד העורף:
מסגרות היום של שירותי הרווחה ברשויות המקומיות סגורות לקבלת קהל, אך בהנחיית המשרד הן יספקו חלופה של תמיכה מרחוק. צוותי המסגרות בקהילה אשר מיועדות לאנשים עם מוגבלות אף יבצעו ביקורי בית בעת הצורך.                                                                                           מרכזי חירום כגון מרכזי אלומה לטיפול באלימות במשפחה, מרכזי חירום לילדים והוסטלים לטיפול בנפגעות תקיפה מינית ממשיכים לפעול בתיאום עם רשויות החירום וההצלה.
שימו לב להנחיות והמידע לאזרחים ותיקים ובני משפחה מטפלים בעקבות המלחמה https://www.gov.il/he/pages/molsa-senior-citizens-iron-swords-information",,,,,,,,,,,,,,,,,,
175,"אנשים פרטיים, הגיל השלישי",עוקץ,התעללות באזרחים ותיקים- מתגבר בתקופת מלחמה,משרד הרווחה והבטחון החברתי- מינהל אזרחים ותיקים ,https://govextra.gov.il/molsa/protecting-senior-citizens/home/,12/06/2025,"בתקופת מלחמה יש מי שמנסה לנצל את האזרחים הותיקים, שימו לב לסימנים,כנסו לאתר להנחיות נוספות התעללות באזרחים ותיקים, נגרמת בדרך כלל על ידי אדם מסביבתם הקרובה - בן משפחה, מטפל זר, מטפל - והיא יכולה להתרחש באופן חד פעמי או קבוע.                              
בכל מקרה של חשש להתעללות, הזנחה או ניצול של אזרח ותיק או חסר ישע, אל תהססו לפנות לשירותי הרווחה או להגיש תלונה במשטרה.
זכרו: הפעולה שלכם יכולה להציל חיים ולהבטיח להם חיים מוגנים ומלאי כבוד.  להלן הנתונים השנתיים שפורסמו ב-15/06/25 לקראת יום המודעות הבינלאומי למאבק בהתעללות והזנחת אזרחים ותיקים:                                                                                                                          נתונים שנתיים על פגיעה באזרחים ותיקים בישראל:          
כמחצית (48%) מכלל הפגיעות באזרחים ותיקים נגרמות על ידי ילדיהם;
בני הזוג מהווים 34% מכלל הפוגעים;
שיעור הפגיעות על ידי מטפל ישראלי עומד על 3% (123 מקרים מסך כל המקרים);
שיעור הפגיעות על ידי מטפל זר עומד על 1% (68 מקרים).
ירידה חדה נרשמה בפגיעות שביצעו אנשים מחוץ למעגל המשפחתי – כמו שכנים, חברים או מטפלים זרים – ייתכן שעקב סגירות, פיקוח משפחתי הדוק יותר והימנעות ממגע חיצוני בתקופת המלחמה. 
 עלייה של 24% בדיווחים על הונאת אזרחים ותיקים על ידי זר או חברה מסחרית
מניתוח הדיווחים החדשים שהתקבלו במרכזים בשנת 2024 עולה כי בכלל סוגי הפגיעות ישנה ירידה לעומת שנה שעברה חוץ מתחום ההונאה על ידי גורם זר (חברה מסחרית לדוגמה).
על פי הנתונים, הפגיעות הנפוצות ביותר הן התעללות נפשית (33%) ומספר המקרים בתחום פגיעה זה בשנה החולפת עמד על 2,660.
מדובר על ירידה של 4% לעומת שנה קודמת אז מספר המקרים היה 2,792.

מספר מקרי ההזנחה מכלל הפגיעות עומד על 22%.
בשנת 2024 דווחו 1,801 מקרים לעומת 1,926 בשנת 2023 - ירידה של 6.5%.

התעללות פיזית וניצול כלכלי עומדים על אחוזים דומים (16%) מכלל סוגי הפגיעות.
בשנת 2024 חלה ירידה של 9.5% במספר המקרים שדווחו על התעללות פיזית וירידה של 9.6% בתחום הניצול הכלכלי על ידי אדם קרוב.

ירידה חדה נרשמה בדיווח על פגיעות מיניות (30.5%).
הסבר אפשרי לכך הוא צמצום ההזדמנויות לפגיעה זו מצד זרים, בשל שהייה ממושכת של אזרחים ותיקים בחיק משפחתם או במקומות סגורים.

התחום היחיד שבו נרשמה עלייה במספר המקרים החדשים שדווחו ליחידות לטיפול ומניעת התעללות והזנחה ברשויות המקומיות הוא הונאה על ידי זר או חברה מסחרית.
אם בשנת 2023 דווחו 109 מקרים, בשנת 2024 חל זינוק של 24% ל-135 מקרים.
העלייה נובעת ככל הנראה על רקע בדידות גוברת של האזרחים הוותיקים, תחכום גובר של שיטות ההונאה וקושי להתמודד עם טכנולוגיות דיגיטליות חדשות. 
הגורמים המדווחים הנפוצים ביותר הם עובדים סוציאליים מהמחלקות לשירותים חברתיים (14%), בני משפחה (14%) ופנייה עצמאית של הנפגע (16%).\

פניות רבות מגיעות גם ממערכת הבריאות (16%).                                                                                                                                                                                                                                                                                                                                                                                                להמשך פירוט כנסו ללינק: https://www.gov.il/he/pages/molsa-news-senior-citizens-neglect-and-abuse-12062025                                                    ",,,,,,,,,,,,,,,,,,
176,"אנשים פרטיים, הגיל השלישי",עזרה הדדית,קבוצות פייסבוק,הזדקנות בכבוד,https://www.facebook.com/groups/2110506565838909/,20/06/2025,"קבוצת פייסבוק מאוד יעילה של בני משפחה המטפלים בהוריהם המתבגרים, יש שם הרבה מידע ועזרה הדדית. כמו כל קבוצת פייסבוק- יש לודא שמה שנאמר הוא נכון ותקין.",,,,,,,,,,,,,,,,,,
