106,"עצמאים/ות, ""תקועים בחו""""ל"", אנשים פרטיים",כניסה/יציאה מישראל,מוקד חירום,ישראייר,https://www.israir.co.il/Passengers_Info/Emergency_Info,19/06/2025,"עדכון בעקבות סגירת המרחב האווירי של מדינת ישראל
עדכון אחרון: 19.6.25 בשעה 10:05
לקוחות יקרים, לצערנו, במהלך 48 השעות האחרונות הצלחנו להוציא לפועל רק 5 טיסות במסגרת ההקצאה שניתנה לנו על ידי משרד התחבורה. יחד עם זאת, אנו מאמינים כי בימים הקרובים נוכל להרחיב את הפעילות ולבצע מספר משמעותי יותר של טיסות. במסגרת הטיסות שכן יצאו, הטסנו משלחות רפואיות, אנשי מערכת הביטחון, עובדי מפתח ונוסעים נוספים בעלי צורך חיוני. אנו מודעים היטב לקושי שבהמתנה הממושכת מחוץ לישראל, וממשיכים לפעול במלוא המרץ כדי לתגבר את תנועת הטיסות ולסייע לכלל הנוסעים לשוב הביתה בהקדם האפשרי.
בהתאם להנחיות משרד התחבורה ורשות שדות התעופה האזרחית, המרחב האווירי של מדינת ישראל נותר תסגור להמראות ולנחיתות, וכל טיסות ישראייר מישראל ואליה – לרבות טיסות לאילת וממנה – מבוטלות בשלב זה עד ליום שני, 30 ביוני (כולל).
בימים אלו אנו פועלים בשיתוף פעולה מלא עם משרד התחבורה, רשות שדות התעופה וגורמי הביטחון, במטרה להפעיל טיסות חילוץ ממספר יעדים חזרה לישראל.
יש לקחת בחשבון כי מספר הטיסות שיאושרו יהיה מוגבל, והפעלתן תיעשה באופן הדרגתי ובהתאם להתפתחויות בשטח.
צוות ישראייר נערך כבר כעת להפעלת טיסות החילוץ הראשונות. מתוך רצון לנהל את התהליך בצורה אחראית ומסודרת, בשלב זה בחרנו שלא לפתוח את מקומות הטיסה להזמנה – זאת עד לייצוב המתווה והבנת מכלול התנאים הכרוכים בו.
בשלב הראשוני, תתמקד החברה בהשבת אלפי נוסעים ששהו בחו""ל במסגרת טיולים מאורגנים וקבוצות סגורות אשר טסו לחו""ל טרם תחילת מבצע ""עם כלביא"", ועדיין שוהים מחוץ לישראל.
החברה תעדיף מקרים דחופים, רפואיים או הומניטריים, בהתאם לשיקול דעתה הבלעדי, וכפוף להנחיות הגורמים המוסמכים.
שיקול הדעת בקביעת הצורך, רמת הדחיפות וסדרי התעדוף ייעשה בהתאם לנתונים ולנסיבות הקיימות, תוך ניסיון למקסם את טובת כלל הנוסעים.
אנו מבינים ללבכם – התחושות של חוסר ודאות, מתח ולעיתים גם תסכול, הן אנושיות ולגמרי מובנות.אנו מבקשים להודות לכם על הסבלנות, ההבנה והאמון שאתם נותנים בנו בתקופה מאתגרת זו.

אנו ממליצים להיערך להמשך שהות בחו""ל ולדאוג לסידורי לינה, מאחר שבכל יום צפוי מספר מוגבל של טיסות חילוץ.
בהמשך, עם התייצבות המצב, ייפתחו טיסות נוספות למכירה דרך אתר האינטרנט של ישראייר. אנו ממליצים לעקוב אחר פרסומים שוטפים באתר וברשתות החברתיות לצורך עדכונים שוטפים לגבי מועדי הטיסות והיעדים השונים.

מדיניות ביטולים:
באפשרות הנוסעים שביצעו הזמנתם באופן ישיר מישראייר ושטיסותיהם הבינלאומיות היו אמורות להמריא בין התאריכים 17.6.25 ועד 30.6.25 ובוטלו , לבחור באחת מהאפשרויות הבאות:
1. זיכוי כספי על פי חוק בגין ההזמנה שהתבטלה.
הזיכוי יעשה ישירות לאמצעי התשלום הרשום בהזמנה
2. שובר למימוש עתידי בתוספת 10% זיכוי על סכום ההזמנה שבוטלה.
 השובר תקף למימוש למשך 24 חודשים מיום הנפקתו
עם קבלת הודעת ביטול הטיסה ב sms , תתאפשר הבחירה באיזור האישי באתר האינטרנט של החברה. https://myisrair.israir.co.il/Account
ביטול טיסות מאילת ואליה בתאריכים הנקובים יזכו את הנוסע בהחזר כספי בלבד עפ""י חוק.הזיכוי יעשה ישירות לאמצעי התשלום הרשום בהזמנה.
מדיניות זו תעודכן בהתאם לצורך.
נוסעים שביצעו הזמנה באמצעות סוכן נסיעות – מתבקשים לפנות ישירות אל סוכן הנסיעות לצורך בקשת זיכוי כספי עבור הזמנתם.
 בשל המצב הביטחוני, מוקד השירות עובד במתכונת חירום .
המוקד יהיה פתוח למענה דיגיטלי בווצאפ בימים א'-ה' בין השעות 09:00 -17:00 וביום שישי בין השעות 09:00-14:00
בטלפון: 03-7955777
ניתן גם לבטל הזמנות באזור האישי באתר:
https://myisrair.israir.co.il/Account

למידע נוסף, עדכונים ושירות לקוחות – לחצו כאן:
www.israir.co.il

ליבנו עם כל לקוחותינו, עם משפחותיהם, ועם אזרחי ישראל באשר הם.
אנו שולחים תפילה לשלום חיילי צה״ל ולשובם הבטוח הביתה של החטופים, ומייחלים לשלום האזרחים",,,,,,,,,,,,,,,,,,
107,"עצמאים/ות, ""תקועים בחו""""ל"", אנשים פרטיים",כניסה/יציאה מישראל,מוקד חירום ,אייר חיפה,https://airhaifa.com/legal-he/updates,20/06/2025,"אייר חיפה: רישום באתר אייר חיפה www.airhaifa.com, שימו לב לעדכונים בעקבות המצב, עדכון אחרון 20/06/2025 שעה 14:30:                                                                                                                                                                                                     ליננ פניות בנושא טיסות חילוץ מנמל התעופה לרנקה (LCA) 
אנו פועלים בימים אלו במתכונת חירום רציפה. יחד עם זאת‚ לצערנו ולאכזבתנו‚ אין ביכולתנו להיענות לכל הפניות – למרות שאנו מאוד מאוד רוצים. לו יכולנו‚ היינו מטיסים ארצה כבר מזמן את כל מי שזקוק לסיוע שלנו.
אנו קוראים כל פנייה בלב פתוח‚ עושים כל שביכולתנו ומבקשים את ההבנה שלכם – ואת הסליחה ממי שאנו לא מצליחים לסייע לו כעת לשביעות רצונו.

חידוש טיסות אייר חיפה שבשגרה
טיסות אייר חיפה הרגילות יתחדשו עם פתיחה גורפת של המרחב האווירי של מדינת ישראל וצפוי כעת לא לפני 28/6.
נוסעים שטיסתם בוטלה‚ יהיו זכאים להחזר כספי שיבוצע באופן אוטומטי תוך 21 ימי עסקים לאמצעי התשלום המקורי איתו בוצעה ההזמנה. אם לא התקבל זיכוי תוך זמן זה‚ אנא צרו עמנו קשר.

לאור שמועות שגויות וניסיונות פישינג מצד גורמים המתחזים למוקד השירות של החברה – נבהיר כי אייר חיפה מעניקה שירות אך ורק באמצעות מספר הוואטסאפ הרשמי
לינק לואטסאפ https://api.whatsapp.com/send?phone=972747755511 או בלחיצה פה https://airhaifa.com/contactus-he/contact , אפשר גם דרך צור קשר באתר.
 תודה על הסבלנות וההבנה.
אייר חיפה",,,,,,,,,,,,,,,,,,
108,"""תקועים בחו""""ל"", אנשים פרטיים, עצמאים/ות",כניסה/יציאה מישראל,מוקד חירום ,TUS AIR,https://www.tusairways.com/he/%d7%a2%d7%93%d7%9b%d7%95%d7%a0%d7%99%d7%9d-%d7%91%d7%a2%d7%a7%d7%91%d7%95%d7%aa-%d7%94%d7%9e%d7%a6%d7%91-%d7%94%d7%91%d7%98%d7%97%d7%95%d7%a0%d7%99/,20/06/2025,"עדכונים בעקבות המצב הביטחוני
טיסות חילוץ דרך עקבה (ירדן) – יוצאות ונכנסות

בעקבות ההתפתחויות הביטחוניות האחרונות וסגירת המרחב האווירי של ישראל, TUS Airways החלה בהפעלת טיסות חילוץ לישראלים מלרנקה ואתונה לעקבה וכן טיסות מעקבה ללרנקה ואתונה.
הטיסות יפעלו בין התאריכים 18 ביוני ועד 23 ביוני וניתן להזמין אותן כעת באתר זה, על בסיס מקום פנוי.
הטיסות מוצעות במתכונת של 'טיסה בלבד', אך ניתן להוסיף להזמנה (במהלך ההזמנה או אחריה) חבילה מורחבת הכוללת:
בטיסות נכנסות לעקבה – טיפול באשרת מעבר בירדן לבעלי דרכון ישראלי, הסעות משדה התעופה בעקבה למעבר גבול רבין (10 דק' נסיעה), וממעבר הגבול רבין אל רכבת מרכז תל אביב (סבידור).  
בטיסות יוצאות מעקבה – טיפול באשרת מעבר בירדן לבעלי דרכון ישראלי, הסעות מרכבת מרכז תל אביב (סבידור) אל מעבר הגבול רבין וממעבר הגבול רבין אל שדה התעופה בעקבה (10 דק' נסיעה).
מידע חשוב לנוסעים
נוסעים שיבחרו שלא לרכוש את החבילה נדרשים לדאוג בעצמם להנפקת אשרת מעבר (מונפקת בתשלום עם הנחיתה בעקבה/ הכניסה לירדן), וכן להסעות בין מעבר רבין לשדה התעופה בעקבה ובין מעבר הגבול רבין לישראל (קיימת תחנת מוניות משני צידי הגבול).
קיימת אזהרת מסע לירדן מטעם המשרדלביטחון לאומי (מומלץ לעיין באזהרה, אותה ניתן למצוא בלינק זה טרם ביצוע ההזמנה)
נכון למועד פרסום זה, התקבלו כל האישורים הנדרשים להפעלת הטיסות. עם זאת, קיומן בפועל מותנה בכך שהאישורים יישארו בתוקף גם במועד הטיסה, ולא יבוטלו או ישתנו עקב המצב הבטחוני. במקרה של ביטול הטיסה – יינתן החזר מלא תוך 3 ימי עסקים. 
נוסעים אשר רכשו חבילה מורחבת נדרשים למלא את פרטי הנוסעים בלינק זה לצורך הנפקת אשרת המעבר(עד שעה ממועד ביצוע ההזמנה).
נוסעים בטיסות היוצאות מעקבה (ירדן) מתבקשים לשלם באופן עצמאי את אגרת היציאה מישראל בסך 107 ₪. תשלום זה אינו כלול במחיר הכרטיס ויש לרכוש אותו מראש באתר חברת מילגם (התשלום מתבצע באופן אישי על ידי הנוסע): https://borderpay.metropolinet.co.il/
ההזמנות מיועדות לבעלי אזרחות ישראלית, אירופית, אמריקאית או קנדית בלבד – באחריות הנוסע לוודא עמידה בתנאי זה.
 
טיסות החברה לישראל
בעקבות ההתפתחויות הביטחוניות האחרונות וסגירת המרחב האווירי של ישראל, TUS Airways ביטלה את כל טיסותיה מישראל ואליה בתאריכים 13 ליוני ועד 30 ליוני (כולל).
טיסות המתוכננות להמראה מה־1 ליולי ועד ה־7 ליולי 2025 נסגרו להזמנות חדשות עד להתבהרות המצב הביטחוני. 
נוסעים המחזיקים כרטיסי טיסה לטיסות אלה מתבקשים שלא להגיע לשדה התעופה, אלא לעקוב אחר העדכונים באמצעי התקשורת, העדכונים השוטפים באתר זה והודעות הנשלחות/יישלחו אליהם מטעמנו בקשר לטיסה הספציפית שלהם.
 
 ",,,,,,,,,,,,,,,,,,
109,"עצמאים/ות, ""תקועים בחו""""ל"", אנשים פרטיים",כניסה/יציאה מישראל,מוקד חירום,TUS AIR,https://www.tusairways.com/,20/06/2025,"בעקבות ההתפתחויות הביטחוניות האחרונות, Tus Airways ביצעה שינויים בלוח הטיסות שלה.
החברה החלה בהפעלת טיסות חילוץ מלרנקה ואתונה לעקבה (ירדן),וכן מעקבה ללרנקה ואתונה הניתנות להזמנה באתר.
כל טיסות החברה אל ומישראל עד לתאריך 30 ליוני (כולל) – מבוטלות.
טיסות החברה בתאריכים 1-7 ליולי סגורות למכירה, עד להתבהרות המצב.
לפרטים נוספים לחץ כאן. https://www.tusairways.com/he/%d7%a2%d7%93%d7%9b%d7%95%d7%a0%d7%99%d7%9d-%d7%91%d7%a2%d7%a7%d7%91%d7%95%d7%aa-%d7%94%d7%9e%d7%a6%d7%91-%d7%94%d7%91%d7%98%d7%97%d7%95%d7%a0%d7%99/                                                                             
בתקווה לימים שקטים יותר, TUS Airways   ",,,,,,,,,,,,,,,,,,
110,"""תקועים בחו""""ל"", אנשים פרטיים, עצמאים/ות",כניסה/יציאה מישראל,מוקד חירום ,מנו ספנות ,https://cruise.mano.co.il/Cruise/1052  או https://cruise.mano.co.il/Cruise/1044,20/06/2025,"מנו ספנות: רישום ורכישת כרטיסים באתר מנו ספנות : https://cruise.mano.co.il/Cruise/1044,שימו לב- יש הפלגה מיוחדת לישראל ומישראל:                                                                                                                                                          בעקבות המצב הביטחוני, אל על בשיתוף ""מנו ספנות"" ארגנה הפלגה מיוחדת שצפויה לצאת מנמל לימסול בקפריסין, ביום חמישי, 26.06.2025, בשעה 13:30. בנוסף, תתקיים הפלגה מישראל ללימסול שצפויה לצאת מנמל אשדוד ביום שלישי, 24.06.2025, בשעה 13:30. לפרטים בדבר מועד העלייה לאונייה ונתונים נוספים אנא התעדכנו באתר ""מנו ספנות"".
 יש רישום ללקוחות אלעל ולכלל הציבור -הפלגה לישראל מקפריסין
ההפלגה מהווה אפשרות נוספת עבור המבקשים לשוב לישראל. ההפלגה מיועדת בעיקרה ללקוחות אל על וסאן דור שטיסתם בוטלה עקב המצב, אך פתוחה לרכישה גם עבור הציבור הרחב:

ההפלגה ללקוחות אל על וסאן דור שטיסתם לישראל בוטלה בעקבות המצב, תהיה ללא עלות ובמקום טיסת חילוץ.
בשל הרכב החדרים, ההרשמה להפלגה תתאפשר לשני אנשים ומעלה.
הציבור הרחב רשאי לרכוש כרטיס להפלגה בעלות מסובסדת של €500 לאדם, באמצעות אתר ""מנו ספנות"".
פעילות זו מתקיימת במקביל לטיסות החילוץ שמבוצעות על ידי אל על. למען הסר ספק, לקוח שנרשם וקיבל אישור על הקצאת מקום עבורו, מוותר על רישומו לטיסת חילוץ וכן על זכותו לקבלת זיכוי על טיסתו שבוטלה.
פרטי ההפלגה:
מועד יציאה: יום חמישי, 26.06.2025 בשעה 13:30 (זמן מקומי).
צ'ק אין: בשעה 08:00.
מיקום: נמל לימסול, קפריסין.
בסיס אירוח: פנסיון מלא.
יעד הגעה: נמל אשדוד, ישראל.
מועד צפוי לעגינה בנמל אשדוד: יום שישי, 27.06.2025, בשעות הבוקר.                                                                                                                                                                                                                                                                                     לחצו על הלינק https://www.elal.com/heb/general/campaigns/special-cruises                                                                                                                                                                                                                                                                                 הפלגה מישראל לקפריסין
ההפלגה מהווה אפשרות לציבור המעוניין לצאת מישראל לחו""ל. ניתן לרכוש כרטיס להפלגה בעלות מסובסדת של €500 לאדם, באמצעות אתר ""מנו ספנות"".

פרטי ההפלגה:
מועד יציאה: יום שלישי, 24.06.2025 בשעה 13:30 (זמן מקומי).
צ'ק אין: בשעה 10:00.
מיקום: נמל אשדוד, ישראל.
בסיס אירוח: פנסיון מלא.
יעד הגעה: נמל לימסול, קפריסין.
מועד צפוי לעגינה בנמל לימסול: יום רביעי, 25.06.2025, בשעות הבוקר.לחצו על הלינק  https://www.elal.com/heb/redirectpage?target=https:%2F%2Fcruise.mano.co.il%2FCruise%2F1052
                                                                                                                                                                                                                                                                                                                                                                                                                                                                                                                   ואטסאפ לשירות לקוחות https://api.whatsapp.com/send?phone=15557383284                                                                                                                                                                                                                                                                        פייסבוק מנו ספנות https://www.facebook.com/groups/528363977241394/user/100064395235345",,,,,,,,,,,,,,,,,,
111,עצמאים/ות,כניסה/יציאה מישראל,,"המל""ל",https://www.gov.il/he/Departments/DynamicCollectors/travel-warnings?skip=0,20/06/2025,"אזהרות מסע מתעדכנות תדיר פה, כשאתם מחפשים טיסות חילוץ- שימו לב שאתם עושים זאת ממדינה בטוחה לישראלים, עד כמה שיש, יש להיוועץ עם חדר המצב ולבדוק באתרים הממשלתיים בלבד.",,,,,,,,,,,,,,,,,,
112,אנשים פרטיים,תלונות,עוקץ,משרד התחבורה/ אביר קארה,https://www.facebook.com/share/p/16pV5211Lm/,20/06/2025,"אני מצטטת כאן מהפוסט שלו,ללא התייחסות למפלגה שהוא משתייך אליו, לא מכירה אותו היכרות אישית. חושבת שהמידע יוכל לסייע למי שצריך,  לינק לפוסט הנ""ל- https://www.facebook.com/share/p/16pV5211Lm/                                                                         ציטוט מכאן: טיפול בעוקץ הרכבים! 
‏בגדול מעבירים לכם בעלות על הרכב, בלי ידיעתכם ובאותו רגע מעבירים עוד בעלות, הנעקצים הם בעלי הרכבים, חברות האשראי, ואלו שנרשמו על שמם רכבים וגם הלוואות.
‏איך להמנע? 
‏1.1 - דרושה זהירות, כאשר מפרסמים רכב למכירה לא מפרסמים את מספר הרכב שלכם בתמונות ולא מוסרים מספר רכב בטלפון לאף אחד. יש דרך נוספת למנוע את העברת הרכב ללא אישורכם והיא לשעבד את הרכב, רכב משועבד לא ניתן להעביר בעלות מבלי לקבל את אישור המשעבד. 
העוקץ הזה קורה רק כאשר אין שיעבוד על הרכב!  1.1 - דרושה זהירות, כאשר מפרסמים רכב למכירה לא מפרסמים את מספר הרכב שלכם בתמונות ולא מוסרים מספר רכב בטלפון לאף אחד. יש דרך נוספת למנוע את העברת הרכב ללא אישורכם והיא לשעבד את הרכב, רכב משועבד לא ניתן להעביר בעלות מבלי לקבל את אישור המשעבד. 
העוקץ הזה קורה רק כאשר אין שיעבוד על הרכב! 
‏1.2 -  הלוואות, מגופים לא מוכרים מסוכנות! 
לא מוסרים פרטים אישיים לגופים שאתם לא מכירים. בטח לא ת״ז ופרטים קריטיים, יש חבורה של נוכלים שיקחו מכם את כל הפרטים ובוקר למחרת תתעוררו כשיש על שמכם הלוואות שלא לקחתם ורכבים שלא קניתם. 
‏חייב לציין שמשטרת ישראל הפתיעה אותי לטובה השבוע שיתפנו פעולה וזה עבד נהדר. 
אתמול שוחחתי גם עם מנכ״ל הדואר כדי לסתום את הפרצה והצלחנו (יחד עם עורכי הדין שלי ענר בר אילן, רותם דרוויש ומיטל ויצמן) להחזיר לשני נעקצים את הרכבים חזרה על שמם ולבטל דרך חברות אשראי הלוואת שקיבלו אנשים מבלי ידיעתם אבל יש עוד עשרות מקרים בטיפול.                                                                                                                                                                                                                                                                                                                                                                                                                                                            פוסט קודם בנושא https://www.facebook.com/share/p/1AyJx9LUzm/  הסיפור מסתבך! 
‏תארו לכם שאתם קמים בבוקר ומגלים שמישהו רשם על שמכם רכב שלא קניתם, לא התעניינתם בו והרכב גם לא נמצא אצלכם, קיבלתם רכב במתנה! 
‏חחח נראה לכם? אין מתנות חינם. והסיכוי שאריאלה ממפעל הפיס תתקשר אליכם שואף לאפס. 
‏אותו אדם רשם על שמכם הלוואה שלא לקחתם וכמובן שלא קיבלתם רכב בתמורה ז״א יש רכב על שמכם אבל הוא לא אצלכם. 
‏עוקץ הרכבים הגדול, תופעה מטורפת של גניבת רישיונות רכב, העברת בעלות בבנק הדואר באמצעות זיוף מסמכים מעבירים בעלות פעמיים באותו יום פעם אחת לגנב ופעם שנייה אליכם, הרכב לא מגיע אליכם אבל ההלוואה והחוב נרשם עליכם. 
‏חננאל בן 72 התעניין בהלוואה העביר פרטים ראשוניים ולאחר מספר ימים הוא גילה שנרשמו על שמו 3 רכבים ושלוש הלוואות. 
‏יוחאי התעניין בהלוואה והשאיר פרטים באינטנרט, ביום ראשון הוא מגלה שנרשמה על שמו הלוואה בסך 200,000 שקלים בחברת פמה ועוד הלוואה בסך 80,000 שקלים דרך חברת בלנדר, שתיהן לצורך רכישת רכב שהוא מעולם לא רכש. 
‏במקרה של יוחאי זה הרכב של אוהד (הבחור מהפוסט אתמול) אוהד לא מכר לו את הרכב, לא פגש אותו ולא נתן לו פרטים. 
‏מדובר בתופעה רחבה לפי הקלטה שיש בידי מדובר  במאות מקרים ורשת של עוקץ מתוחכמת. 
‏הוגשו עשרות תלונות במשטרה, רובן נסגרו מבלי בדיקה של ממש. 
‏יש הלוואה, יש העברת כספים לצד ג׳, יש עדויות, אנשים נעקצים במאות אלפי שקלים אבל אין מי שיגן עליהם. 
‏אין בישראל מערכת חוק, אין מדינה, אין משטרה ואין מערכת משפט, הרשות המבצעת בפשיטת רגל אין מנהיגות, אין הנהלה ויש אפס יוזמה. 
‏ כך מאות נעקצים עומדים מול שוקת שבורה! 
‏אם זה קרה גם לכם או למישהו שאתם מכירים אנה מכם הפנו אליי בפרטי, יחד עם עורכי הדין שלי ענר בר אילן, רותם דרוויש ועורכת הדין מיטל ויצמן אנחנו ממפים ומטפלים בנפגעים. 
‏אני בדרך למשטרת נתניה אמשיך לעדכן בהמשך.",,,,,,,,,,,,,,,,,,
