"נעים להכיר, מוֹרָן תְּסַדֵּר 
פתחתי גוגל שיטס מתעדכן לתועלת הציבור עם הטבות מתעדכנות. מאגר ההטבות נבנה לטובת הקהילה. הכי נח לפתוח מהדסקטופ (הוספנו גם רוסית!)
---> איך עובדים עם הקובץ כך שזה יהיה הכי יעיל עבורך?                                                                                                                                                                                                                                                                                                                      
ניתן להשתמש בפילטר על מנת לקבל את המידע שרלוונטי אליכם, זהו קובץ בעבודה.                                                                                        
צפו בסרטון  איך עושים פילטר (סינון) לטבלה:                                                                                             
לא בא לכם סרטון? לכו לפי ההוראות פה- איך עושים פילטר-לוחצים על הטור ""למי זה""-  הולכים לסרגל למעלה -לוחצים על DATA (השישי משמאל)- ואז CREATE FILTER VIEW ואז מפלטרים לפי מה שרלוונטי לכם בטור (למי זה, קטגוריה וכן הלאה). 
יש מספר קטגוריות, ההטבה הכי מעודכנת היא זו שבתחתית כל קטגוריה- כדי שיהיה לכם/ן נח.  תסננו לפי למי ההטבה או לפי קטגוריה או לפי תאריך או לפי משרד ממשלתי.                                                                                                        
תמיד אפשר לעשות CTRL F אם מחפשים משהו ספציפי .מי שמעדיף את ה-Airtable- לכו ללינק הזה                                                                                                         
                                                                                           ",,,,,,,,,,,,,,,,,,,,,,,,,
קישור לעמוד העסקי,קישור לטלגרם ,קישור לואטסאפ- תשאלו חופשי,,,,,,,,,,,,,,,,,,,,,,,
,דיסקליימר חשוב: אין לראות בתוכן זה המלצה/ ייעוץ. תודה רבה לצביקה אבנרי ולמורד שטרן על העזרה.,,,,,,,,,,,,,,,,,,,,,,,,
Post ID,למי זה ,קטגוריה,תת קטגוריה,שם המשרד/ הארגון,לינק לפרטים ,מתי עודכן ,פרטים (האותיות הקטנות),Column 9,Column 10,Column 11,Column 12,Column 13,Column 14,Column 15,Column 16,Column 17,Column 18,Column 19,Column 20,Column 21,Column 22,Column 23,Column 24,Column 25,Column 26
,,קבלת קהל,מוקד חירום,,,,,,,,,,,,,,,,,,,,,,
6,"כולם, ""תקועים בחו""""ל"", נפגע בית 🏠, נפגע רכב 🚗, נפגע עסק 💼, עובדים, מעסיקים, נפגעי גוף / נפש, עצמאים/ות, אנשים פרטיים",זכויות,מוקד חירום,"מערך הדיגיטל ומשרד רוה""מ",https://www.gov.il/he/departments/il-emergency-services/govil-landing-page,19/06/2025,"""כל השירותים החיוניים בישראל – במקום אחד: דשבורד ממשלתי חדש נפתח לציבור הרחב עם כל המידע החיוני לאזרחים- הדשבורד הוא חלק מהיערכות הלאומית להתמודדות עם מצב החירום, ומונגש לציבור באופן פשוט ונוח – בטלפון הנייד ובמחשב. 

הדשבורד הוקם ביוזמת ובליווי רשות החירום הלאומית (רח״ל) פותח ומתוחזק על ידי מערך הדיגיטל הלאומי, בשיתוף ומערך ההסברה הלאומי במשרד ראש הממשלה, ומכיל בשלב זה מידע מתעדכן ואינטראקטיבי מטעם משרד הבריאות, משרד הכלכלה ובנק ישראל, כאשר שירותי משרדים נוספים יועלו בהמשך. 

לחצו כאן לכניסה לפורטל שירותים חיוניים ומפת השירותים החיוניים בישראל:
https://www.gov.il/he/departments/il-emergency-services/govil-landing-page""",,,,,,,,,,,,,,,,,,
7,"נפגעי פעולות איבה, נפגע בית 🏠, עצמאים/ות",זכויות,אתר מרכז זכויות,מערך הדיגיטל הלאומי,https://www.facebook.com/share/v/16UFcffVLN/,19/06/2025,"טופס מאוד חשוב:
ביתכם נפגע כתוצאה ממצב החירום? 
אתם לא לבד .
התחברו למערכת ׳יחד׳ ומלאו את הטופס לדיווח עצמי, כך תוכלו לעדכן את משרדי הממשלה והרשות המקומית במצבכם ובצרכים שלכם על מנת שנוכל לסייע לכם.
📌 כדאי לדעת: במיוחד בימים אלו מומלץ לבצע הרשמה למערכת הזדהות לאומית, כדי שתוכלו להתחבר לשירותי הממשלה מהדיגיטל בקלות ובמהירות. 
למילוי הטופס במערכת יחד >> https://www.gov.il/he/service/yachad",,,,,,,,,,,,,,,,,,
8,"נפגעי גוף / נפש, נפגע רכב 🚗, נפגע בית 🏠, נפגע עסק 💼",זכויות,אתר מרכז זכויות,כיוונים,https://www.kivunimrights.com/,19/06/2025,"אתר מעולה שנותן מידע על כל  הזכאויות וצ'קליסט מעודכן איך להתקדם: ריכזנו את המידע הרלוונטי ועשינו בו סדר: 
מיינו את הזכויות לפי סוג המקרה 
פירטנו את הפעולות שצריך לבצע כדי לממש את הזכויותסידרנו את הפעולות לפי סדר הדחיפות
הוספנו הנחיות מדויקות לביצוע
השימוש במערכת לא דורש הזדהות, אלא רק תשובות לכמה שאלות על מצבך, כך שהפרטיות שלך נשמרת",,,,,,,,,,,,,,,,,,
9,"מעסיקים, עצמאים/ות",זכויות והטבות לעסקים/עצמאיים,אתר מרכז זכויות,מערך הדיגיטל הלאומי,https://www.gov.il/apps/digital/business-benefits,24/06/2025,"שאלון עם 5 שלבים- מתחילים פה- תצטרכו למלא את מה שרלוונטי לם ואפשר יותר מתשובה אחת- האם נגרם נזק לעסק עקב המצב הבטחוני (מלחמת ""חרבות ברזל"", מבצע ""עם כלביא"" ואירועים אחרים? 
איפה נמצא העסק?
מה היה המחזור של העסק בשנת 2023?
איזה מהאפשרויות רלוונטית לעסק?
לאיזה ענף שייך העסק?
ואז לוחצים המשך להצגת ההטבות לא לדלג!
",,,,,,,,,,,,,,,,,,
10,"נשים, אנשים פרטיים, נפגעי גוף / נפש, נפגעי פעולות איבה, עובדים, מעסיקים, ""תקועים בחו""""ל""",זכויות,מוקד חירום,הרשות לקידום מעמד האישה,https://www.facebook.com/photo/?fbid=1132634432231640&set=a.477648547730235,20/06/2025,"כל נערה ואישה בכל רשות מקומית/מועצה אזורית יכולה לפנות ליועצת לקידום מעמד האישה על מנת להציף אתגרים עימם היא מתמודדת וקבל מענה/חיבור לגורמים הרלוונטיים במגוון נושאים כגון: תעסוקה, חינוך והשכלה, ייצוג הולם, מניעת אלימות, זכויות, מידע ובריאות. 
לפרטי התקשרות עם היועצות לקידום מעמד האישה היכנסו ללינק המצורף 👇https://www.gov.il/he/pages/local_authorities_consultants_contact_info?fbclid=IwY2xjawLCUntleHRuA2FlbQIxMABicmlkETFhTjRIZG5sRjZ4MUR3UGJ4AR5R_h5HSx1h2myItHUxUKn5iW0iHKuu_13YvXq_QcmqBfoA2mYgSt2ZWmEd0w_aem_hQqfYcZp6Ke-WeGWXdheWA ",,,,,,,,,,,,,,,,,,
11,"נפגעי פעולות איבה, נפגעי גוף / נפש, ""תקועים בחו""""ל"", הגיל השלישי",זכויות והטבות לעסקים/עצמאיים,"מוקד חירום , ""מוקד חירום, אתר מרכז זכויות """,גיידסטאר,https://www.guidestar.org.il/sector/displaced-families?fireglass_rsn=true#fireglass_params&tabid=abbc4b474323e90e&application_server_address=fgtehilacloud-3-me-west1.prod.fire.glass&popup=true&is_right_side_popup=false&start_with_session_counter=1&utm_source=go.gov.il&utm_medium=referral,22/06/2025,"בדף זה תמצאו את כלארגוני הסיוע לפי תחומים: סיוע נפשי, סיוע כספי וציוד, סיוע בלינה, סיוע במזון ואחר https://www.guidestar.org.il/sector/displaced-families?fireglass_rsn=true#fireglass_params&tabid=abbc4b474323e90e&application_server_address=fgtehilacloud-3-me-west1.prod.fire.glass&popup=true&is_right_side_popup=false&start_with_session_counter=1&utm_source=go.gov.il&utm_medium=referral",,,,,,,,,,,,,,,,,,
12,"נפגע עסק 💼, נפגע בית 🏠, נפגעי פעולות איבה, אנשים פרטיים, חירשים/ כבדי שמיעה, עולים חדשים, הגיל השלישי, משרתי מילואים",הגשת תביעה,,,https://www.facebook.com/share/p/16LqnXw3Hk/,,"זכויות המגיעות לאזרח שביתו נפגע ונקבע שאינו ראוי למגורים:
1. קורת גג מגורים בבית מלון, פינוי הובלה וכל העלויות הכרוכות בכך, אוכל ומענה ראשוני, כלכלה מלאה במימון מלא של המדינה באמצעות הרשות המקומית. 
הגורם המטפל- הרשות המקומית בגגיבוי עם גמישות מקסימלית של הממשלה. 
קריטריונים: ההחלטה אם הבית ראוי למגורים נקבעת ע""י הרשות המקומית ומהדנס העיר בהתאם לקריטרינים שגובשו במשותף עם קרן הפיצויים ברשות המיסים. מי שיבחר  בדיור חלפי שוני כמו מעבר מיידי לשכירות או לבית קרובים זכאי להשתתפות כספית מקרן הפיצויים ברשות המיסים. יש לפנות בעניין לצוותמס רכוש שיגיע לביתכם שנפגע.
2. הזכות מענק ראשוני - דמי כיס- מענק ראשוני בסך 500 ש""ח יועברו לכל תושב שפונה מביתו ושנקבע שאינו ראוי למגורים, הסכומים יועברו בימים הקרובים.
3. הזכות מענה לצרכים יומיומיים- מענה לצרכים יומיומיים כמו כביסה למתאכסנים במלונות וצרכים פרטניים- ילדים, נגישות, סיוע ממשלתי, תוך שיפוי מלא מהמדינה.
4. הזכות- שיפוץ או בניה מחדש - שיפוץ או בניה מחדש של הבית באופן מלא תוך החזרת המצב לקדמותו- קרןהפיצויים של רשות המיסים. אם הנזק לביתכם אינו עולה על סך של 30,000 ש""ח אז ניתן לתקן את הנזקים ללא ביקור נציג מס רכוש לאחר הגשת תביעה במסלול המהיר- אם הנזק גודל מכך, ניתן לשפץ רק לאחר ביקור של אנשי מס רכוש ואישור שמאי. תיקון נזקי הדף ונזיק שאינם מונעים מגורים יכולים להתבצע באופן מיידי לאחר ביקור נציג מס רכוש- רצוי להיערך מראש עם הצעת מחיר.
5. הזכות- שמירה (שימו לב בפועל אנשים בוזזים)- שמירה על אתרי ההרס מבוצעת על ידי הרשויות המקומיות במימון קרן הפיצויים, לכאורה.
6. היכן ניתן לקבל מידע?- סרקו את הברקוד בתמונה בקישור https://www.facebook.com/photo/?fbid=1176593054501932&set=pcb.1176593104501927


",,,,,,,,,,,,,,,,,,
13,"""תקועים בחו""""ל""",כניסה/יציאה מישראל,,לאומי,https://web.leumi.co.il/RVw,22/06/2025,"בנק לאומי מתגייס למאמצי החזרת הישראלים מחו""ל 🇮🇱

הבנק יוציא אונייה מיוחדת מנמל לימסול בקפריסין ביום שני הקרוב, 23.6.25, בשעה 10:00 בבוקר, אשר תחזיר לארץ כמות גדולה של ישראלים.

ההרשמה להפלגה פתוחה לכלל הישראלים בתשלום מסובסד של 600 אירו לכרטיס, כאשר ללקוחות לאומי העלות מופחתת – 300 אירו בלבד לכרטיס.

ההרשמה נפתחת החל מהיום ב-16:00 באתר הבנק.

ניתן להירשם בקישור הבא>>
https://web.leumi.co.il/RVw

תמיד לשירותכם – בכל מצב,
בנק לאומי
",,,,,,,,,,,,,,,,,,
14,"אנשים פרטיים, נשים",זכויות,"מוקד חירום, אתר מרכז זכויות",הרשות לקידום מעמד האישה,https://www.facebook.com/photo/?fbid=1249493936539110&set=a.498979918257186&locale=he_IL,18/06/2025,"מוקד חירום לנשים *8840, גם בעברית, צרפתית, רוסית, אנגלית, ערבית ואמהרית https://www.facebook.com/photo/?fbid=1249499513205219&set=a.498979918257186&locale=he_IL",,,,,,,,,,,,,,,,,,
15,"אנשים פרטיים, נשים",מידע ,"מוקד חירום, אתר מרכז זכויות","מערך הדיגיטל ומשרד רוה""מ",https://govextra.gov.il/national-digital-agency/rising-lion-info/home/,18/06/2025,"פורטל מתארגנים מחדש- מידע לתושבים שביתם נפגע ונקבע שאינו ראוי למגורים.אתר זה נועד לרכז עבורכם את המידע, ההנחיות וההפניות לשירותים המרכזיים – וללוות אתכם בהתארגנות מחדש בתקופה זו. האתר מתחלק ל-3 חלקים: מענה ראשוני, התארנגות במצב החדש ושגרה במצב חדש. לסיוע למפונים וחסרי קורת גג לחצו כאן https://www.gov.il/he/service/yachad, יש אפשרות גם ליצור קשר טלפוני בשפות עברית, ערבית, אגנלית ורוסית  במספר 1299 בין השעות 08:00-19:00.",,,,,,,,,,,,,,,,,,
16,"נפגעי גוף / נפש, אנשים פרטיים, עצמאים/ות",טיפול נפשי,מוקד חירום,ביטוח לאומי,https://www.btl.gov.il/About/news/Pages/MokedHarada.aspx,13/06/2025,"מוקד טלפוני לנפגעי חרדה-  קו ארצי של מרכזי חוסן- עקב המצב הבטחוני והכרזה על מצב מיוחד בעורף, הקו  הארצי של מרכזי החוסן פתוח  24/7. וגם קו חירום לסיוע מיידי לפתועים ולמשפחות שכולות- 02-6269999- הקו פעיל בימים א-ה  בין השעות 08:00-18:00 ,            אזרחים החשים חרדה לאור המצב מוזמנים להתקשר למספר - 5486*.​                                                                                                                                                                                                                                                                                                                                                         בנוסף שאלות או הצעות בנושא הנגישות בביטוח הלאומי בלבד תוכלו להפנות לגברת ענת עובדיה מנהלת חטיבה-ממונה ארצית נגישות השירות בדואר אלקטרוני: anatov@nioi.gov.il  או באתר https://www.btl.gov.il/About/contact_us/Pages/neguishut.aspx
",,,,,,,,,,,,,,,,,,
17,"אנשים פרטיים, נפגעי גוף / נפש, עצמאים/ות",טיפול נפשי,מוקד חירום,"ביטוח לאומי, משרד הבריאות ",https://www.facebook.com/share/v/16WNpf7wSf/,19/06/2025,"אם הייתם באזורי הנפילות, אתם חשים חרדה או מצוקה נפשית שמקשה על התפקוד שלכם - אנו מממנים לכם טיפולים אישיים, זוגיים או משפחתיים עם מטפלים מומחים וללא בירוקרטיה. 
לרשימת מרכזי החוסן והמרכזים הרפואיים הרשמיים כנסו - https://www.btl.gov.il/.../Pages/MrkaziHosenResima.aspx
* הסיוע בשיתוף משרד הבריאות והקואליציה הישראלית לטראומה",,,,,,,,,,,,,,,,,,
18,"עצמאים/ות, אנשים פרטיים, עובדים",זכויות והטבות לעסקים/עצמאיים,,כל זכות ומשרדי ממשלה,https://www.kolzchut.org.il/he/%D7%A9%D7%90%D7%9C%D7%95%D7%AA_%D7%95%D7%AA%D7%A9%D7%95%D7%91%D7%95%D7%AA_%D7%9C%D7%A2%D7%95%D7%91%D7%93%D7%99%D7%9D_%D7%95%D7%9C%D7%9E%D7%A2%D7%A1%D7%99%D7%A7%D7%99%D7%9D_%D7%91%D7%AA%D7%A7%D7%95%D7%A4%D7%AA_%D7%94%D7%9E%D7%9C%D7%97%D7%9E%D7%94_%D7%9E%D7%95%D7%9C_%D7%90%D7%99%D7%A8%D7%90%D7%9F,19/06/2025,"שאלות ותשובות לעובדים ולמעסיקים בנוגע לזכאויות במבצע ""עם כלביא"" כולל הגדרת מקומות חיוניים והישארות בבית עם הילד (חופשות וכו').",,,,,,,,,,,,,,,,,,
19,"עצמאים/ות, מעסיקים",זכויות והטבות לעסקים/עצמאיים,,כל זכות ומשרדי ממשלה,https://www.kolzchut.org.il/he/%D7%A0%D7%97%D7%99%D7%AA%D7%94:%D7%96%D7%9B%D7%95%D7%99%D7%95%D7%AA_%D7%97%D7%A9%D7%95%D7%91%D7%95%D7%AA_%D7%9C%D7%A2%D7%A6%D7%9E%D7%90%D7%99%D7%9D_%D7%95%D7%9C%D7%91%D7%A2%D7%9C%D7%99_%D7%A2%D7%A1%D7%A7%D7%99%D7%9D_%D7%91%D7%AA%D7%A7%D7%95%D7%A4%D7%AA_%D7%94%D7%9E%D7%9C%D7%97%D7%9E%D7%94_%D7%9E%D7%95%D7%9C_%D7%90%D7%99%D7%A8%D7%90%D7%9F,19/06/2025,"בעקבות מבצע ""עם כלביא"", אזרחים רבים נפגעו בנפש וברכוש, לצד חוסר ודאות בנוגע לזכויות במקום העבודה, דיור ועוד. בשיתוף עם ""ביזגוב"", ריכזנו עבורכם זכויות, הטבות והקלות שכדאי לעצמאים ולבעלי עסקים להכיר.",,,,,,,,,,,,,,,,,,
20,"עצמאים/ות, מעסיקים, נפגע עסק 💼",זכויות והטבות לעסקים/עצמאיים,,"מערך הדיגיטל ומשרד רוה""מ",https://www.gov.il/apps/digital/business-benefits,19/06/2025,"הטבות לעסקים: ריכזנו כאן מידע על הטבות של המדינה לבעלי ובעלות עסקים, עם תשומת לב מיוחדת לעסקים שנפגעו עקב המצב הביטחוני.   
כדי להציג רשימת הטבות מותאמת לעסק שלך נבקש ממך לענות על כמה שאלות לגביו. בכל הטבה שתופיע ברשימה יהיו מידע קצר וקישורים להגשת הבקשה. 
השימוש באתר לא מצריך הזדהות, כך שהפרטיות נשמרת. אנחנו מעדכנים את האתר באופן קבוע אך ייתכן שקיימות הטבות שלא מוצגות בו. הצגת הטבה ברשימת ההטבות לא מעידה בהכרח על זכאות",,,,,,,,,,,,,,,,,,
21,"עצמאים/ות, מעסיקים",זכויות מס,,רשות המיסים ,https://www.facebook.com/share/p/19pCPkxzVB/,15/06/2025,"דחיית מועד הדיווח והתשלום התקופתי במע”מ, ניכויים ומקדמות מס הכנסה לחודש מאי – עד ליום 26.6.2025",,,,,,,,,,,,,,,,,,
22,"עצמאים/ות, מעסיקים",זכויות מס,,רשות המיסים ,https://www.facebook.com/share/p/19pCPkxzVB/,15/06/2025,דחיית מועד הגשת הדו”חות השנתיים לשנת 2024 ליחידים ולחברות – עד 31.7.2025 (ללא קשר להסדר הארכות),,,,,,,,,,,,,,,,,,
23,"עצמאים/ות, מעסיקים",זכויות מס,,רשות המיסים ,https://www.facebook.com/share/p/19pCPkxzVB/,15/06/2025,"הארכת מועד הגשת דו”חות לשנת 2023:
 • לחברות – עד 30.6.2025 (בהסדר הארכות)
 • ליחידים – עד 30.6.2025, ללא קנס על פיגור",,,,,,,,,,,,,,,,,,
24,"עצמאים/ות, מעסיקים",זכויות מס,,רשות המיסים ,https://www.facebook.com/share/p/19pCPkxzVB/,15/06/2025,"הגשת  דו”חות ניכויים לשנת 2024 (טפסים 126 ו-856) – הוארכה עד 31.7.2025, ללא עיצום כספי",,,,,,,,,,,,,,,,,,
25,"עצמאים/ות, מעסיקים",זכויות מס,,רשות המיסים ,https://www.facebook.com/share/p/19pCPkxzVB/,15/06/2025,"הגשת דיווח ותשלום שנתי לעסק זעיר לשנת 2024 – הוארכה עד 31.7.2025
(לבעלי עסקים שקיבלו מענקים/פיצויים –הוארכה עד 31.8.2025)",,,,,,,,,,,,,,,,,,
26,"אנשים פרטיים, עצמאים/ות",מידע ,,רשות המיסים ,https://www.facebook.com/share/p/19pCPkxzVB/,15/06/2025,הקפאת עיקולים והליכי הוצאה לפועל עד ליום 30.6.2025 בכלל מערכי המס – למעט מקרים חריגים באישור מיוחד,,,,,,,,,,,,,,,,,,
27,"נפגע בית 🏠, נפגע רכב 🚗, נפגע עסק 💼",הגשת תביעה,,קרן הפיצויים- רשות המיסים ,https://www.facebook.com/share/r/1J8DDQArAg/,15/06/2025,"הגשה לנזק ישיר למי שהמבנה ו/הרכוש (התכולה) נפגעו במלחמה - קרן הפיצויים של רשות המיסים: להתקשר *4954 ולהקליט את השיחה, שימו לב שאתם מופנים למוקד שלכם (לפי איזור המגורים) או דרך פניה. כתבו בגוגל ""תביעה מקוונת נזק ישיר""- עליכם לפתוח את הפניה ממש בסמוך לאירוע+ לשמור לכם מספר פניה למעקב, לצלם הכל כולל הכל - תמונות ווידאו, עדיף ל לגעת בכלוםלא לפנות ציוד או מלאי מהבית או מהעסק עד שיגיע השמאי, אפשר לפנות זכוכיות שבורות. השלב הבא נציג קרן הפיצויים ושמאי יגיעו אליכם בהקדם האפשרי כדי להעריך את הנזק ויתנו לכם למלא טופס תביעה- קריטי- מה שלא יופיע בטופס- לא תוכלו לתבוע בהמשך, לא לחתום על אישור בשלב הזה,לשלוח במעמד הפגישה את כל התמונות לשמא. יצר אתכם קשר אז לשבת עליו כל יום עד שנותן תשובות.  השלב הבא השמאי יעשה הערכה (לרו בהערכת חסר ויתנו מקדמה עבור הנזק למבנה ושאר התשלום יועבר עם הצגת חשבונית מהקבלן. תכולה- פיצויים עבור נזק לתכולה יהיו לפי התקרות  והחוק והרכב המשפחה אלא אם עשיתם ביטוח רשות לחפצים פרטיים  דרך אתר רשות המיסים.
",,,,,,,,,,,,,,,,,,
28,נפגע בית 🏠,הגשת תביעה,,קרן הפיצויים- רשות המיסים ,https://www.facebook.com/photo?fbid=1172758901552404&set=a.318884123606557&locale=he_IL,17/06/2025,"שימו לב לעדכון בשורה הבאה : 17.6.25: מסלול מהיר להגשת תביעות לנזק ישיר עד 30,000 ש""ח לנזק במבנה תכולה- לאנשים פרטיים בלבד- אישור תביעה עד 7 ימי עסקיםללא המתנה לשמאי- בליווי ניירת תומכת (הצהרה , תמונות ומסמכים). האותיות הקטנות: מחייב הזדהות דיגיטלית + הגשת הצהרה ומסמכים (כולל תמונות)
• תביעה אחת בלבד לכל תא משפחתי ולאירוע
• נדרש להגיש חשבונית עד 30 יום ממועד קבלת הפיצוי – אחרת יידרש החזר.                                                                                                                             👥 לצד המסלול המהיר, ממשיכים לפעול:
1. מסלול רגיל עם הזדהות – כולל מעקב אישי והעלאת מסמכים גם לאחר ההגשה
2. מסלול רגיל ללא הזדהות – באמצעות מספר תעודת זהות או דרכון  
🖥️ להגשת תביעה ולפרטים נוספים >> היכנסו לאתר רשות המסים
תביעה מקוונת - נזק ישיר | רשות המסים בישראל https://www.gov.il/he/service/online-direct-damage-claim",,,,,,,,,,,,,,,,,,
